124;244;001-30;4680008140586.0;Отбеливатель для древесиныPROSEPT 50концентрат 1:1 / 30 л;3792.0;7358.0;35.0;Отбеливатель для древесины PROSEPT 50концентрат 1:1 / 30 л;Отбеливатель для древесиныPROSEPT 50концентрат 1:1 / 30 л;Отбеливатель для древесиныPROSEPT 50концентрат 1:1 / 30 л;;;;
125;309;007-30;4680008140555.0;Огнебиозащита ОГНЕБИО PROF l, 1 группа, красный готовый состав / 30 л;2267.0;5401.0;38.0;Огнебиозащита для древесиныPROSEPT ОГНЕБИО PROF l,1 группа, красный готовый состав / 30 л;Огнебиозащита для древесиныPROSEPT ОГНЕБИО PROF l,1 группа, красный готовый состав / 30 л;Огнебиозащита для древесиныPROSEPT ОГНЕБИО PROF l,1 группа, красный готовый состав / 30 л;;;;
126;305;007-65бц;4680008146199.0;Огнебиозащита   ОГНЕБИО PROF l, 1 группа, бесцветный готовый состав / 65 л;4838.0;11529.0;38.0;Огнебиозащита для древесины PROSEPT ОГНЕБИО PROF l,1 группа, бесцветный готовый состав / 65 л;Огнебиозащита для древесины PROSEPT ОГНЕБИО PROF l,1 группа, бесцветный готовый состав / 65 л;Огнебиозащита для древесины PROSEPT ОГНЕБИО PROF l,1 группа, бесцветный готовый состав / 65 л;;;;
127;301;007-5бц;4680008145000.0;Огнебиозащита ОГНЕБИО PROF I, 1 группа, бесцветный готовый состав / 5 л;407.0;970.0;38.0;Огнебиозащита для древесиныPROSEPT ОГНЕБИО PROF I1 группа, бесцветный готовый состав / 5 л;Огнебиозащита для древесиныPROSEPT ОГНЕБИО PROF I1 группа, бесцветный готовый состав / 5 л;Огнебиозащита для древесиныPROSEPT ОГНЕБИО PROF I1 группа, бесцветный готовый состав / 5 л;508035205.0;;;
128;499;М037-2;4610093421413.0;Антисептик ULTRA коричневый, концентрат, 1 л, 2 шт;720.0;1645.0;;Антисептик ULTRA коричневый, концентрат, 1 л, 2 шт;Антисептик ULTRA коричневый, концентрат, 1 л, 2 шт;Антисептик ULTRA коричневый, концентрат, 1 л, 2 шт;;;;
129;500;М038-2;4610093421437.0;Антисептик ULTRA MAX, концентрат, 1 кг, 2 шт;828.0;1890.0;;Антисептик ULTRA MAX, концентрат, 1 кг, 2 шт;Антисептик ULTRA MAX, концентрат, 1 кг, 2 шт;Антисептик ULTRA MAX, концентрат, 1 кг, 2 шт;;;;
130;93;157-5/5;4680008143945.0;Гель эконом-класса для мытья  посуды вручную. С ароматом фруктовCooky Fruit Eконцентрированное средство / 5 л ПЭТ;314.52;682.0;41.0;Гель эконом-класса для мытья  посуды вручную. С ароматом фруктовCooky Fruit Eконцентрированное средство / 5 л ПЭТ;Гель эконом-класса для мытья  посуды вручную. С ароматом фруктовCooky Fruit Eконцентрированное средство / 5 л ПЭТ;Гель эконом-класса для мытья  посуды вручную. С ароматом фруктовCooky Fruit Eконцентрированное средство / 5 л ПЭТ;;;;
131;89;127-05;4680008145451.0;Гель для мытья  посуды вручную. Без запахаCooky Fruit с ароматом фруктовконцентрированное средство / 0,5 л ;80.0;174.0;41.0;Гель для мытья  посуды вручную. Без запахаCooky Fruit с ароматом фруктовконцентрированное средство / 0,5 л ;Гель для мытья  посуды вручную. Без запахаCooky Fruit с ароматом фруктовконцентрированное средство / 0,5 л ;Гель для мытья  посуды вручную. Без запахаCooky Fruit с ароматом фруктовконцентрированное средство / 0,5 л ;;;;
132;501;М039-2;4610093421444.0;Антисептик  SAUNA, концентрат, 1 л, 2 шт;634.0;1445.0;;Антисептик  SAUNA, концентрат, 1 л, 2 шт;Антисептик  SAUNA, концентрат, 1 л, 2 шт;Антисептик  SAUNA, концентрат, 1 л, 2 шт;;;;
133;59;111-075;4680008146786.0;Средство для устранения засоров в трубахBath Profконцентрат 1:100 / 0,75 л;76.78;180.0;45.0;Средство для устранения засоров в трубахBath Profконцентрат 1:100 / 0,75 л;Средство для устранения засоров в трубахBath Profконцентрат 1:100 / 0,75 л;Средство для устранения засоров в трубахBath Profконцентрат 1:100 / 0,75 л;;;;
134;201;114-1;4680008148254.0;Средство для мытья стекол и зеркалOptic Crystalготовый состав / 1 л ;103.0;244.0;51.0;Средство для мытья стекол и зеркалOptic Crystalготовый состав / 1 л ;Средство для мытья стекол и зеркалOptic Crystalготовый состав / 1 л ;Средство для мытья стекол и зеркалOptic Crystalготовый состав / 1 л ;;;;
135;192;D1 02005;4610093420058.0;"Дезинфицирующее средство ПРОФ ДЗ ""PROF DZ"" готовый состав / 5 л ";1164.0;0.0;21.0;"Дезинфицирующее средство ПРОФ ДЗ ""PROF DZ"" готовый состав / 5 л ";"Дезинфицирующее средство ПРОФ ДЗ ""PROF DZ"" готовый состав / 5 л ";"Дезинфицирующее средство ПРОФ ДЗ ""PROF DZ"" готовый состав / 5 л ";;;;
136;7;181-5;4680008143211.0;Универсальное моющее средство эконом - классаUniversal E концентрат 1:10-1:100 / 5 л;306.84;808.0;56.0;Универсальное моющее средство эконом - классаUniversal E концентрат 1:10-1:100 / 5 л;Универсальное моющее средство эконом - классаUniversal E концентрат 1:10-1:100 / 5 л;Универсальное моющее средство эконом - классаUniversal E концентрат 1:10-1:100 / 5 л;;;;
137;165;260-04;4680008146427.0;Чистящее средство, отбеливающий эффектCrystal Lux готовый состав / 0,4 л;58.62;108.0;56.0;Чистящее средство, отбеливающий эффектCrystal Lux готовый состав / 0,4 л;Чистящее средство, отбеливающий эффектCrystal Lux готовый состав / 0,4 л;Чистящее средство, отбеливающий эффектCrystal Lux готовый состав / 0,4 л;;;;
138;94;300-5/5;4680008148162.0;Гель эконом-класса для мытья посуды вручную. С ароматом лимонаCooky Gel Lemon концентрированное средство / 5 л ПЭТ;350.0;760.0;41.0;Гель эконом-класса для мытья посуды вручную. С ароматом лимонаCooky Gel Lemon концентрированное средство / 5 л ПЭТ;Гель эконом-класса для мытья посуды вручную. С ароматом лимонаCooky Gel Lemon концентрированное средство / 5 л ПЭТ;Гель эконом-класса для мытья посуды вручную. С ароматом лимонаCooky Gel Lemon концентрированное средство / 5 л ПЭТ;;;;
139;420;069-12;4680008149695.0;Краска резиновая белый Ral 9003 / 12 кг;3206.0;6711.0;30.0;Краска резиновая PROSEPT SuperRubberбелый Ral 9003 / 12 кг;Краска резиновая белый Ral 9003 / 12 кг;Краска резиновая PROSEPT SuperRubberбелый Ral 9003 / 12 кг;575101161.0;;;
140;99;306-20;4680008148759.0;Средство для мытья посуды в посудомоечной машине. Для жесткой водыCooky Splash Softконцентрат 1:200-1:2000 / 20 л;2912.0;6316.0;42.0;Средство для мытья посуды в посудомоечной машине. Для жесткой водыCooky Splash Softконцентрат 1:200-1:2000 / 20 л;Средство для мытья посуды в посудомоечной машине. Для жесткой водыCooky Splash Softконцентрат 1:200-1:2000 / 20 л;Средство для мытья посуды в посудомоечной машине. Для жесткой водыCooky Splash Softконцентрат 1:200-1:2000 / 20 л;;;;
141;268;009-30;4680008140784.0;Антисептик для влажной древесиныPROSEPT BiOконцентрат 1:19  / 30 л;6096.0;11109.0;20.0;Антисептик для влажной древесиныPROSEPT BiOконцентрат 1:19  / 30 л;Антисептик для влажной древесиныPROSEPT BiOконцентрат 1:19  / 30 л;Антисептик для влажной древесиныPROSEPT BiOконцентрат 1:19  / 30 л;;;;
142;274;017-65;4680008143853.0;Антисептик невымываемыйPROSEPT ECO ULTRAготовый состав / 65 л;2845.0;6780.0;20.0;Антисептик невымываемыйPROSEPT ECO ULTRAготовый состав / 65 л;Антисептик невымываемыйPROSEPT ECO ULTRAготовый состав / 65 л;Антисептик невымываемыйPROSEPT ECO ULTRAготовый состав / 65 л;;;;
143;252;061-30;4680008148933.0;Антисептик невымываемыйPROSEPT ULTRAкоричневый концентрат 1:10 / 30л;8011.0;14980.0;20.0;Антисептик невымываемыйPROSEPT ULTRAкоричневый концентрат 1:10 / 30л;Антисептик невымываемыйPROSEPT ULTRAкоричневый концентрат 1:10 / 30л;Антисептик невымываемыйPROSEPT ULTRAкоричневый концентрат 1:10 / 30л;;;;
144;278;062-65;4680008149022.0;Антисептик  ECO ULTRA, коричневый / 65 л;2845.0;6780.0;20.0;Антисептик невымываемыйPROSEPT ECO ULTRA, коричневыйготовый состав / 65 л;Антисептик  ECO ULTRA, коричневый / 65 л;Антисептик невымываемыйPROSEPT ECO ULTRA, коричневыйготовый состав / 65 л;;;;
145;188;D1 01100;4680008148599.0;"Кожный антисептик ПРОФ ДЗ ""PROF DZ"" готовый состав / 0,1 л";56.0;0.0;21.0;"Кожный антисептик ПРОФ ДЗ ""PROF DZ"" готовый состав / 0,1 л";"Кожный антисептик ПРОФ ДЗ ""PROF DZ"" готовый состав / 0,1 л";"Кожный антисептик ПРОФ ДЗ ""PROF DZ"" готовый состав / 0,1 л";;;;
146;455;М008-3;4610093421215.0;Кожный антисептик PROF DZ готовый состав / 0,05 л;133.2;267.0;21.0;Антисептик для рук PROSEPT PROF DZ, 3 штуки*50 мл.;Антисептик для рук PROSEPT PROF DZ, 3 штуки*50 мл.;Антисептик для рук PROSEPT PROF DZ, 3 штуки*50 мл.;;;D1-01050-3;
147;471;М010-2;4610093421178.0;"Концентрат для мытья полов и стен  Multipower ""Полевые цветы"" 0,8 л";156.0;364.0;50.0;"Средство для мытья полов PROSEPT Multipower ""Полевые цветы"", 2 штуки*0.8 л.";"Средство для мытья полов PROSEPT Multipower ""Полевые цветы"", 2 штуки*0.8 л.";"Средство для мытья полов PROSEPT Multipower ""Полевые цветы"", 2 штуки*0.8 л.";451252387.0;;М010-2;
148;335;031-2;4680008145888.0;Антисептик лессирующий BiO LASUR / бесцветный / 2,7 л;721.0;1717.0;31.0;Антисептик лессирующийзащитно-декоративныйPROSEPT BiO LASUR / бесцветный / 2,7 л;Антисептик лессирующийзащитно-декоративныйPROSEPT BiO LASUR / бесцветный / 2,7 л;Антисептик лессирующийзащитно-декоративныйPROSEPT BiO LASUR / бесцветный / 2,7 л;577627474.0;;;
149;432;073-12;4680008149817.0;Краска резиновая коричневый Ral 8017 / 12 кг;3206.0;6711.0;30.0;Краска резиновая PROSEPT SuperRubberкоричневый Ral 8017 / 12 кг;Краска резиновая коричневый Ral 8017 / 12 кг;Краска резиновая PROSEPT SuperRubberкоричневый Ral 8017 / 12 кг;574948571.0;;;
150;429;072-12;4680008149787.0;Краска резиновая серый Ral 7004 / 12 кг;3206.0;6711.0;30.0;Краска резиновая PROSEPT SuperRubberсерый Ral 7004 / 12 кг;Краска резиновая серый Ral 7004 / 12 кг;Краска резиновая PROSEPT SuperRubberсерый Ral 7004 / 12 кг;575102144.0;;;
151;331;032-09;4680008145932.0;Антисептик лессирующий BiO LASUR / белый люкс / 0,9 л;255.0;607.0;31.0;Антисептик лессирующийзащитно-декоративныйPROSEPT BiO LASUR / белый люкс / 0,9 л;Антисептик лессирующийзащитно-декоративныйPROSEPT BiO LASUR / белый люкс / 0,9 л;Антисептик лессирующийзащитно-декоративныйPROSEPT BiO LASUR / белый люкс / 0,9 л;576551777.0;;;
152;332;032-2;4680008145949.0;Антисептик лессирующий BiO LASUR / белый люкс / 2,7 л;721.0;1717.0;31.0;Антисептик лессирующийзащитно-декоративныйPROSEPT BiO LASUR / белый люкс / 2,7 л;Антисептик лессирующийзащитно-декоративныйPROSEPT BiO LASUR / белый люкс / 2,7 л;Антисептик лессирующийзащитно-декоративныйPROSEPT BiO LASUR / белый люкс / 2,7 л;577415658.0;;;
153;334;031-09;4680008145871.0;Антисептик лессирующий BiO LASUR / бесцветный / 0.9 л;255.0;607.0;31.0;Антисептик лессирующийзащитно-декоративныйPROSEPT BiO LASUR / бесцветный / 0.9 л;Антисептик лессирующийзащитно-декоративныйPROSEPT BiO LASUR / бесцветный / 0.9 л;Антисептик лессирующийзащитно-декоративныйPROSEPT BiO LASUR / бесцветный / 0.9 л;577627003.0;;;
154;355;033-09;4680008145901.0;Антисептик лессирующий BiO LASUR / сосна / 0,9 л;255.0;607.0;31.0;Антисептик лессирующийзащитно-декоративныйPROSEPT BiO LASUR / сосна / 0,9 л;Антисептик лессирующийзащитно-декоративныйPROSEPT BiO LASUR / сосна / 0,9 л;Антисептик лессирующийзащитно-декоративныйPROSEPT BiO LASUR / сосна / 0,9 л;577433910.0;;;
155;176;139-5;4680008142276.0;Жидкое гель-мыло эконом-класса. Без красителей и ароматизаторовDiona Eготовый состав / 5 л ;227.69;494.0;33.0;Жидкое гель-мыло эконом-класса. Без красителей и ароматизаторовDiona Eготовый состав / 5 л ;Жидкое гель-мыло эконом-класса. Без красителей и ароматизаторовDiona Eготовый состав / 5 л ;Жидкое гель-мыло эконом-класса. Без красителей и ароматизаторовDiona Eготовый состав / 5 л ;;;;
156;180;223-5;4680008143808.0;Пенное мыло для дозаторов. С цветочным ароматомDiona Aromaконцентрат / 5 л ;465.74;848.0;33.0;Пенное мыло для дозаторов. С цветочным ароматомDiona Aromaконцентрат / 5 л ;Пенное мыло для дозаторов. С цветочным ароматомDiona Aromaконцентрат / 5 л ;Пенное мыло для дозаторов. С цветочным ароматомDiona Aromaконцентрат / 5 л ;;;;
157;175;139-5/5;4680008144232.0;Жидкое гель-мыло эконом-класса. Без красителей и ароматизаторовDiona Eготовый состав / 5 л ПЭТ;176.86;384.0;33.0;Жидкое гель-мыло эконом-класса. Без красителей и ароматизаторовDiona Eготовый состав / 5 л ПЭТ;Жидкое гель-мыло эконом-класса. Без красителей и ароматизаторовDiona Eготовый состав / 5 л ПЭТ;Жидкое гель-мыло эконом-класса. Без красителей и ароматизаторовDiona Eготовый состав / 5 л ПЭТ;;;;
158;178;144-5/5;4680008143914.0;жидкое гель-мыло эконом-класса. C ароматом яблокаDiona Citrus Eготовое средство / 5 л ПЭТ;176.86;384.0;33.0;жидкое гель-мыло эконом-класса. C ароматом яблокаDiona Citrus Eготовое средство / 5 л ПЭТ;жидкое гель-мыло эконом-класса. C ароматом яблокаDiona Citrus Eготовое средство / 5 л ПЭТ;жидкое гель-мыло эконом-класса. C ароматом яблокаDiona Citrus Eготовое средство / 5 л ПЭТ;;;;
159;173;147-5/5;4680008144218.0;Жидкое гель-мыло с перламутром. C ароматом яблокаDiona Appleготовый состав / 5 л ПЭТ;221.0;479.0;33.0;Жидкое гель-мыло с перламутром. C ароматом яблокаDiona Appleготовый состав / 5 л ПЭТ;Жидкое гель-мыло с перламутром. C ароматом яблокаDiona Appleготовый состав / 5 л ПЭТ;Жидкое гель-мыло с перламутром. C ароматом яблокаDiona Appleготовый состав / 5 л ПЭТ;;;;
160;174;149-5/5;4680008144225.0;Жидкое гель-мыло с перламутром. C ароматом цитрусовыхDiona Citrus готовый состав / 5 л ПЭТ;221.0;479.0;33.0;Жидкое гель-мыло с перламутром. C ароматом цитрусовыхDiona Citrus готовый состав / 5 л ПЭТ;Жидкое гель-мыло с перламутром. C ароматом цитрусовыхDiona Citrus готовый состав / 5 л ПЭТ;Жидкое гель-мыло с перламутром. C ароматом цитрусовыхDiona Citrus готовый состав / 5 л ПЭТ;;;;
161;360;035-9;4680008146106.0;Антисептик лессирующий BiO LASUR / бук / 9 л;2159.0;5145.0;31.0;Антисептик лессирующийзащитно-декоративныйPROSEPT BiO LASUR / бук / 9 л;Антисептик лессирующийзащитно-декоративныйPROSEPT BiO LASUR / бук / 9 л;Антисептик лессирующийзащитно-декоративныйPROSEPT BiO LASUR / бук / 9 л;;;;
162;199;228-5;4680008144362.0;Нейтрализатор запаха с ароматом морского бризаFlox Sea I  готовый состав / 5 л ;568.0;1327.0;34.0;Нейтрализатор запаха с ароматом морского бризаFlox Sea I  готовый состав / 5 л ;Нейтрализатор запаха с ароматом морского бризаFlox Sea I  готовый состав / 5 л ;Нейтрализатор запаха с ароматом морского бризаFlox Sea I  готовый состав / 5 л ;;;;
163;297;006-65;4680008143907.0;Огнебиозащита ОГНЕБИО PROF 2 группа, бесцветный готовый состав / 65 л;3276.0;7806.0;38.0;Огнебиозащита для древесиныPROSEPT ОГНЕБИО PROF2 группа, бесцветный готовый состав / 65 л;Огнебиозащита для древесиныPROSEPT ОГНЕБИО PROF2 группа, бесцветный готовый состав / 65 л;Огнебиозащита для древесиныPROSEPT ОГНЕБИО PROF2 группа, бесцветный готовый состав / 65 л;;;;
164;304;007-30бц;4680008145161.0;Огнебиозащита ОГНЕБИО PROF l, 1 группа, бесцветный готовый состав / 30 л;2267.0;5401.0;38.0;Огнебиозащита для древесиныPROSEPT ОГНЕБИО PROF l,1 группа, бесцветный готовый состав / 30 л;Огнебиозащита для древесиныPROSEPT ОГНЕБИО PROF l,1 группа, бесцветный готовый состав / 30 л;Огнебиозащита для древесиныPROSEPT ОГНЕБИО PROF l,1 группа, бесцветный готовый состав / 30 л;;;;
165;310;007-65;4680008143860.0;Огнебиозащита ОГНЕБИО PROF l, 1 группа, красный готовый состав / 65 л;4838.0;11529.0;38.0;Огнебиозащита для древесиныPROSEPT ОГНЕБИО PROF l,1 группа, красный готовый состав / 65 л;Огнебиозащита для древесиныPROSEPT ОГНЕБИО PROF l,1 группа, красный готовый состав / 65 л;Огнебиозащита для древесиныPROSEPT ОГНЕБИО PROF l,1 группа, красный готовый состав / 65 л;;;;
166;314;063-20И;;ОГНЕБИОЗАЩИТА  I группа, красный  готовый состав / 20 кг;1548.0;3036.0;38.0;PROSEPT огнебиозащита для древесины с цветовой индикацией. Высшая (1-ая) группа, 20л.;PROSEPT огнебиозащита для древесины с цветовой индикацией. Высшая (1-ая) группа, 20л.;PROSEPT огнебиозащита для древесины с цветовой индикацией. Высшая (1-ая) группа, 20л.;;;;
167;92;130-5/5;4680008143938.0;Гель эконом-класса для мытья  посуды вручную. С ароматом яблокаCooky Apple Eконцентрированное средство / 5 л ПЭТ;314.52;682.0;41.0;Гель эконом-класса для мытья  посуды вручную. С ароматом яблокаCooky Apple Eконцентрированное средство / 5 л ПЭТ;Гель эконом-класса для мытья  посуды вручную. С ароматом яблокаCooky Apple Eконцентрированное средство / 5 л ПЭТ;Гель эконом-класса для мытья  посуды вручную. С ароматом яблокаCooky Apple Eконцентрированное средство / 5 л ПЭТ;;;;
168;91;131-5/5;4680008143488.0;Гель эконом-класса для мытья  посуды вручную. Без запахаCooky Е концентрированное средство / 5 л ПЭТ;314.52;682.0;41.0;Гель эконом-класса для мытья  посуды вручную. Без запахаCooky Е концентрированное средство / 5 л ПЭТ;Гель эконом-класса для мытья  посуды вручную. Без запахаCooky Е концентрированное средство / 5 л ПЭТ;Гель эконом-класса для мытья  посуды вручную. Без запахаCooky Е концентрированное средство / 5 л ПЭТ;;;;
