367;156;288-1;4680008147301.0;Жидкое моющее средство для стирки белых и светлых тканейCrystal Whiteконцентрат / 1 л ;201.0;436.0;22.0;Гель для стирки белых тканей PROSEPT Crystal White, 1 л.;Гель для стирки белых тканей PROSEPT Crystal White, 1 л.;Гель для стирки белых тканей PROSEPT Crystal White, 1 л.;446046060.0;150032634.0;288-1;
368;266;009-5;4680008140487.0;Антисептик для влажной древесиныPROSEPT BiOконцентрат 1:19 / 5 л;1153.0;2498.0;20.0;Антисептик для влажной древесины PROSEPT BiO, концентрат, 5 л.;Антисептик для влажной древесины PROSEPT BiO, концентрат, 5 л.;Антисептик для влажной древесины PROSEPT BiO, концентрат, 5 л.;452589519.0;150033508.0;009-5;
369;279;013-5;4680008140265.0;Антисептик  ECO EXTERIOR / 5 л;258.0;613.0;20.0;Антисептик для наружных работ PROSEPT ECO EXTERIOR, гот.состав, 5л;Антисептик  ECO EXTERIOR / 5 л;Антисептик для наружных работ PROSEPT ECO EXTERIOR, гот.состав, 5л;189522778.0;150033492.0;013-5;
370;157;288-3;4680008147257.0;Жидкое моющее средство для стирки белых и светлых тканейCrystal Whiteконцентрат / 3 л ;493.0;1070.0;22.0;Гель для стирки белых тканей PROSEPT Crystal White, 3 л.;Гель для стирки белых тканей PROSEPT Crystal White, 3 л.;Гель для стирки белых тканей PROSEPT Crystal White, 3 л.;449017374.0;150032635.0;288-3;
371;428;072-3;4680008149770.0;Краска резиновая серый Ral 7004 / 3 кг;845.0;1769.0;30.0;Краска резиновая PROSEPT SuperRubber, серый Ral 7004, 3 кг.;Краска резиновая серый Ral 7004 / 3 кг;Краска резиновая PROSEPT SuperRubber, серый Ral 7004, 3 кг.;288171255.0;149705168.0;072-3;
372;399;021-5;4680008140722.0;Очиститель фасадов SALT CLEANER концентрат 1:2 / 5 л;1151.0;2742.0;35.0;Очиститель фасадов PROSEPT SALT CLEANER, концентрат, 5 л.;Очиститель фасадов PROSEPT SALT CLEANER, концентрат, 5 л.;Очиститель фасадов PROSEPT SALT CLEANER, концентрат, 5 л.;453039913.0;149976261.0;021-5;
373;285;014-10;4680008140302.0;Антисептик для внутренних работ ECO INTERIOR / 10 л;464.0;1107.0;20.0;Антисептик для внутренних работ PROSEPT ECO INTERIOR, 10л.;Антисептик для внутренних работ ECO INTERIOR / 10 л;Антисептик для внутренних работ PROSEPT ECO INTERIOR, 10л.;189522781.0;150033504.0;014-10;
374;311;075-16;4610093420171.0;Сухой концентрат огнебиозащита мешок / 16 кг;2873.0;6424.0;38.0;Огнебиозащита для древесины PROSEPT ОГНЕБИО PROF 1  Высшая (1-ая) группа, концентрат 16кг б/мешок;Сухой концентрат огнебиозащита мешок / 16 кг;Огнебиозащита для древесины PROSEPT ОГНЕБИО PROF 1  Высшая (1-ая) группа, концентрат 16кг б/мешок;189522745.0;150123389.0;075-16;
375;284;014-5;4680008140296.0;Антисептик для внутренних работ ECO INTERIOR/ 5 л;251.0;598.0;20.0;Антисептик для внутренних работ PROSEPT ECO INTERIOR, 5л.;Антисептик для внутренних работ ECO INTERIOR/ 5 л;Антисептик для внутренних работ PROSEPT ECO INTERIOR, 5л.;189522786.0;150033507.0;014-5;
376;425;071-3;4680008149749.0;Краска резиновая зеленый мох Ral 6005 / 3 кг;845.0;1769.0;30.0;Краска резиновая PROSEPT SuperRubber, зеленый мох Ral 6005, 3 кг.;Краска резиновая зеленый мох Ral 6005 / 3 кг;Краска резиновая PROSEPT SuperRubber, зеленый мох Ral 6005, 3 кг.;288171256.0;149705169.0;071-3;
377;130;153-04;4680008146328.0;Средство для удаления граффити, маркера, краскиDuty Graffiti готовый состав, аэрозоль / 0,4 л;207.52;485.0;40.0;Средство для удаления граффити PROSEPT DUTY GRAFFITI, 400 мл.;Средство для удаления граффити PROSEPT DUTY GRAFFITI, 400 мл.;Средство для удаления граффити PROSEPT DUTY GRAFFITI, 400 мл.;449777160.0;149705834.0;153-04;
378;112;278-1;4680008147011.0;Средство для мытья фасадов и дорожных покрытийDuty Hard +   концентрат / 1 л ;149.0;349.0;40.0;Средство для мытья фасадов и дорожных покрытий PROSEPT Duty Hard Plus, 1 л.;Средство для мытья фасадов и дорожных покрытий PROSEPT Duty Hard Plus, 1 л.;Средство для мытья фасадов и дорожных покрытий PROSEPT Duty Hard Plus, 1 л.;451788695.0;149705855.0;278-1;
379;23;158-5;4680008142481.0;Средство для мытья полов всех типовMultipower Neutral концентрат 1:64 - 1:500 / 5 л;601.76;1405.0;50.0;Средство для мытья полов с антистатическим эффектом PROSEPT Multipower Neutral, 5 л.;Средство для мытья полов с антистатическим эффектом PROSEPT Multipower Neutral, 5 л.;Средство для мытья полов с антистатическим эффектом PROSEPT Multipower Neutral, 5 л.;451043219.0;149811052.0;158-5;
380;113;278-5;4680008147028.0;Средство для мытья фасадов и дорожных покрытийDuty Hard +   концентрат / 5 л;567.0;1325.0;40.0;Средство для мытья фасадов и дорожных покрытий PROSEPT Duty Hard Plus, 5 л.;Средство для мытья фасадов и дорожных покрытий PROSEPT Duty Hard Plus, 5 л.;Средство для мытья фасадов и дорожных покрытий PROSEPT Duty Hard Plus, 5 л.;451797208.0;149705856.0;278-5;
381;131;153-2;4680008143433.0;Средство для удаления граффити, маркера, краскиDuty Graffiti готовый состав, аэрозоль / 2 л;1401.65;3274.0;40.0;Средство для удаления граффити PROSEPT DUTY GRAFFITI, 2 л.;Средство для удаления граффити PROSEPT DUTY GRAFFITI, 2 л.;Средство для удаления граффити PROSEPT DUTY GRAFFITI, 2 л.;189522838.0;149705833.0;153-2;
382;424;071-1;4680008149732.0;Краска резиновая зеленый мох Ral 6005 / 1 кг;310.0;649.0;30.0;Краска резиновая PROSEPT SuperRubber, зеленый мох Ral 6005, 1 кг.;Краска резиновая зеленый мох Ral 6005 / 1 кг;Краска резиновая PROSEPT SuperRubber, зеленый мох Ral 6005, 1 кг.;288171267.0;149705175.0;071-1;
383;306;007-5;4680008140524.0;Огнебиозащита ОГНЕБИО PROF l, 1 группа, красный готовый состав / 5 л;407.0;970.0;38.0;Огнебиозащита для древесины Prosept ОГНЕБИО PROF 1 Высшая (1-ая) группа, с цветовой индикацией, 5л.;Огнебиозащита для древесины Prosept ОГНЕБИО PROF 1 Высшая (1-ая) группа, с цветовой индикацией, 5л.;Огнебиозащита для древесины Prosept ОГНЕБИО PROF 1 Высшая (1-ая) группа, с цветовой индикацией, 5л.;189522731.0;150123489.0;007-5;
384;308;007-20;4680008140548.0;Огнебиозащита ОГНЕБИО PROF l, 1 группа, красный готовый состав / 20 л;1623.0;3867.0;38.0;Огнебиозащита для древесины PROSEPT ОГНЕБИО PROF 1 Высшая (1-ая) группа, с цветовой индикацией, 20л.;Огнебиозащита для древесины PROSEPT ОГНЕБИО PROF 1 Высшая (1-ая) группа, с цветовой индикацией, 20л.;Огнебиозащита для древесины PROSEPT ОГНЕБИО PROF 1 Высшая (1-ая) группа, с цветовой индикацией, 20л.;189522736.0;150123492.0;007-20;
385;303;007-20бц;4680008144973.0;Огнебиозащита ОГНЕБИО PROF l, 1 группа, бесцветный готовый состав / 20 л;1623.0;3867.0;38.0;Огнебиозащита для древесины PROSEPT ОГНЕБИО PROF 1 Высшая (1-ая) группа, 20л.;Огнебиозащита для древесины PROSEPT ОГНЕБИО PROF 1 Высшая (1-ая) группа, 20л.;Огнебиозащита для древесины PROSEPT ОГНЕБИО PROF 1 Высшая (1-ая) группа, 20л.;189522737.0;150123394.0;007-20бц;
386;296;006-20;4680008140227.0;Огнебиозащита ОГНЕБИО PROF 2 группа, бесцветный готовый состав / 20 л;848.0;2021.0;38.0;Огнебиозащита для древесины PROSEPT ОГНЕБИО PROF 2-ая группа, 20л.;Огнебиозащита для древесины PROSEPT ОГНЕБИО PROF 2-ая группа, 20л.;Огнебиозащита для древесины PROSEPT ОГНЕБИО PROF 2-ая группа, 20л.;189522738.0;150123395.0;006-20;
387;264;004-5;4680008140135.0;Антисептик для внутренних работPROSEPT SAUNAконцентрат 1:10 / 5 л;1295.0;3086.0;20.0;Антисептик для бани и сауны PROSEPT SAUNA, концентрат, 5 л.;Антисептик для бани и сауны PROSEPT SAUNA, концентрат, 5 л.;Антисептик для бани и сауны PROSEPT SAUNA, концентрат, 5 л.;245491415.0;150033021.0;004-5;
388;427;072-1;4680008149763.0;Краска резиновая серый Ral 7004 / 1 кг;310.0;649.0;30.0;Краска резиновая PROSEPT SuperRubber, серый Ral 7004, 1 кг.;Краска резиновая серый Ral 7004 / 1 кг;Краска резиновая PROSEPT SuperRubber, серый Ral 7004, 1 кг.;288171261.0;149705171.0;072-1;
389;430;073-1;4680008149794.0;Краска резиновая коричневый Ral 8017 / 1 кг;310.0;649.0;30.0;Краска резиновая PROSEPT SuperRubber, коричневый Ral 8017, 1 кг.;Краска резиновая коричневый Ral 8017 / 1 кг;Краска резиновая PROSEPT SuperRubber, коричневый Ral 8017, 1 кг.;288171262.0;149705172.0;073-1;
390;419;069-3;4680008149688.0;Краска резиновая белый Ral 9003 / 3 кг;845.0;1769.0;30.0;Краска резиновая PROSEPT SuperRubber, белый Ral 9003, 3 кг.;Краска резиновая белый Ral 9003 / 3 кг;Краска резиновая PROSEPT SuperRubber, белый Ral 9003, 3 кг.;288171264.0;149705173.0;069-3;
391;421;070-1;4680008149701.0;Краска резиновая черный Ral 9004  / 1 кг;310.0;649.0;30.0;Краска резиновая PROSEPT SuperRubber, черный Ral 9004, 1 кг.;Краска резиновая черный Ral 9004  / 1 кг;Краска резиновая PROSEPT SuperRubber, черный Ral 9004, 1 кг.;288171266.0;149705174.0;070-1;
392;422;070-3;4680008149718.0;Краска резиновая черный Ral 9004  / 3 кг;845.0;1769.0;30.0;Краска резиновая PROSEPT SuperRubber, черный Ral 9004, 3 кг.;Краска резиновая черный Ral 9004  / 3 кг;Краска резиновая PROSEPT SuperRubber, черный Ral 9004, 3 кг.;288171268.0;149705176.0;070-3;
393;299;006-20к;4680008141279.0;Огнебиозащита ОГНЕБИО PROF 2 группа, красный готовый состав / 20 л;848.0;2021.0;38.0;Огнебиозащита для древесины PROSEPT ОГНЕБИО PROF 2-ая группа, с цветовой индикацией, 20л.;Огнебиозащита для древесины PROSEPT ОГНЕБИО PROF 2-ая группа, с цветовой индикацией, 20л.;Огнебиозащита для древесины PROSEPT ОГНЕБИО PROF 2-ая группа, с цветовой индикацией, 20л.;189522739.0;150123493.0;006-20к;
394;133;261-04;4680008146342.0;Средство для изделий из кожи, очистка и уходDuty Leather готовый состав, аэрозоль / 0,4 л ;103.68;241.0;47.0;Средство для ухода за изделиями из кожи PROSEPT Duty Leather, 400 мл.;Средство для ухода за изделиями из кожи PROSEPT Duty Leather, 400 мл.;Средство для ухода за изделиями из кожи PROSEPT Duty Leather, 400 мл.;449803454.0;152971291.0;261-04;
395;302;007-10бц;4680008144966.0;Огнебиозащита ОГНЕБИО PROF l, 1 группа, бесцветный готовый состав / 10 л;814.0;1940.0;38.0;Огнебиозащита для древесины PROSEPT ОГНЕБИО PROF 1 Высшая (1-ая) группа, 10 л.;Огнебиозащита для древесины PROSEPT ОГНЕБИО PROF 1 Высшая (1-ая) группа, 10 л.;Огнебиозащита для древесины PROSEPT ОГНЕБИО PROF 1 Высшая (1-ая) группа, 10 л.;189522712.0;150123391.0;007-10бц;
396;258;003-5;4680008140104.0;Антисептик для внутренних работPROSEPT INTERIORконцентрат 1:10 / 5 л;820.0;1953.0;20.0;Антисептик для внутренних работ PROSEPT INTERIOR, концентрат, 5 л.;Антисептик для внутренних работ PROSEPT INTERIOR, концентрат, 5 л.;Антисептик для внутренних работ PROSEPT INTERIOR, концентрат, 5 л.;189522704.0;150033469.0;003-5;
397;416;068-5;4680008149619.0;Антисептик многофункциональный ФБС, ГОСТ / 5 л;198.0;414.0;20.0;Антисептик многофункциональный PROSEPT ФБС ГОСТ, 5 л.;Антисептик многофункциональный PROSEPT ФБС ГОСТ, 5 л.;Антисептик многофункциональный PROSEPT ФБС ГОСТ, 5 л.;253565308.0;150033501.0;068-5;
398;320;004-025;4680008143242.0;Масло для защиты полков в саунах и банях SAUNA OIL / 0,25 л;175.0;418.0;32.0;Масло для защиты дерева и полков PROSEPT SAUNA OIL, 250 мл.;Масло для защиты дерева и полков PROSEPT SAUNA OIL, 250 мл.;Масло для защиты дерева и полков PROSEPT SAUNA OIL, 250 мл.;189522706.0;150124412.0;004-025;
399;251;061-20;4680008148926.0;Антисептик невымываемыйPROSEPT ULTRAкоричневый концентрат 1:10 / 20л;5414.0;10126.0;20.0;Антисептик невымываемый PROSEPT ULTRA, коричневый, концентрат, 20 л.;Антисептик невымываемый PROSEPT ULTRA, коричневый, концентрат, 20 л.;Антисептик невымываемый PROSEPT ULTRA, коричневый, концентрат, 20 л.;253565306.0;150033488.0;061-20;
400;257;003-1;4680008140098.0;Антисептик для внутренних работPROSEPT INTERIORконцентрат 1:10 / 1 л;211.0;504.0;20.0;Антисептик для внутренних работ PROSEPT INTERIOR, концентрат, 1 л.;Антисептик для внутренних работ PROSEPT INTERIOR, концентрат, 1 л.;Антисептик для внутренних работ PROSEPT INTERIOR, концентрат, 1 л.;189522708.0;150033495.0;003-1;
401;417;068-10;4680008149824.0;Антисептик многофункциональный ФБС, ГОСТ / 10 л;372.0;779.0;20.0;Антисептик многофункциональный PROSEPT ФБС ГОСТ, 10 л.;Антисептик многофункциональный PROSEPT ФБС ГОСТ, 10 л.;Антисептик многофункциональный PROSEPT ФБС ГОСТ, 10 л.;253565307.0;150033498.0;068-10;
402;250;061-5;4680008148841.0;Антисептик невымываемыйPROSEPT ULTRAкоричневый концентрат 1:10 / 5 л;1729.0;4121.0;20.0;Антисептик невымываемый PROSEPT ULTRA, коричневый, концентрат, 5 л.;Антисептик невымываемый PROSEPT ULTRA, коричневый, концентрат, 5 л.;Антисептик невымываемый PROSEPT ULTRA, коричневый, концентрат, 5 л.;253565311.0;150033490.0;061-5;
403;255;002-20;4680008140081.0;Антисептик трудновымываемый для наружных работ PROSEPT EXTERIORконцентрат 1:19 / 20 л;4302.0;8045.0;20.0;Антисептик для наружных работ PROSEPT EXTERIOR, концентрат, 20 л.;Антисептик для наружных работ PROSEPT EXTERIOR, концентрат, 20 л.;Антисептик для наружных работ PROSEPT EXTERIOR, концентрат, 20 л.;189522841.0;150033506.0;002-20;
404;217;004-1/1;4610093420577.0;Масло для защиты полков в саунах и баняхPROSEPT SAUNA OILготовый  состав  /  1 л;487.0;1160.0;32.0;Масло для защиты дерева и полков PROSEPT SAUNA OIL, 1 л.;Масло для защиты дерева и полков PROSEPT SAUNA OIL, 1 л.;Масло для защиты дерева и полков PROSEPT SAUNA OIL, 1 л.;453184311.0;150124413.0;004-1/1;
405;253;002-1;4680008140050.0;Антисептик трудновымываемый для наружных работ PROSEPT EXTERIORконцентрат 1:19 / 1 л;298.0;708.0;20.0;Антисептик для наружных работ PROSEPT EXTERIOR, концентрат, 1 л.;Антисептик для наружных работ PROSEPT EXTERIOR, концентрат, 1 л.;Антисептик для наружных работ PROSEPT EXTERIOR, концентрат, 1 л.;189522709.0;150033502.0;002-1;
406;312;063-10;4680008149565.0;ОГНЕБИОЗАЩИТА  I группа, бесцветный готовый состав / 10 кг;714.0;1609.0;38.0;PROSEPT огнебиозащита для древесины. Высшая (1-ая) группа, 10л.;PROSEPT огнебиозащита для древесины. Высшая (1-ая) группа, 10л.;PROSEPT огнебиозащита для древесины. Высшая (1-ая) группа, 10л.;452497003.0;150123392.0;063-10;
407;452;064-10и;4680008149541.0;ОГНЕБИОЗАЩИТА для древесины 2 группа, красный готовый  состав / 10 кг;409.0;888.0;38.0;PROSEPT огнебиозащита для древесины с цветовой индикацией. 2-ая группа, 10 л.;PROSEPT огнебиозащита для древесины с цветовой индикацией. 2-ая группа, 10 л.;PROSEPT огнебиозащита для древесины с цветовой индикацией. 2-ая группа, 10 л.;452551327.0;150123490.0;064-10и;
408;401;022-1;4680008140456.0;Удалитель цемента CEMENT CLEANER концентрат 1:2 / 1 л;275.0;654.0;35.0;Удалитель цемента PROSEPT CEMENT CLEANER, концентрат, 1л.;Удалитель цемента PROSEPT CEMENT CLEANER, концентрат, 1л.;Удалитель цемента PROSEPT CEMENT CLEANER, концентрат, 1л.;189522725.0;149982743.0;022-1;
409;286;016-5;4680008140326.0;Антисептик для бани и сауны ECO SAUNA готовый состав / 5 л;256.0;610.0;20.0;Антисептик для бани и сауны PROSEPT ECO SAUNA, 5 л.;Антисептик для бани и сауны PROSEPT ECO SAUNA, 5 л.;Антисептик для бани и сауны PROSEPT ECO SAUNA, 5 л.;189522748.0;150033553.0;016-5;
410;479;063-20и;4680008149527.0;PROSEPT огнебиозащита для древесины с цветовой индикацией. Высшая (1-ая) группа, 20л.;1548.0;3036.0;;;PROSEPT огнебиозащита для древесины с цветовой индикацией. Высшая (1-ая) группа, 20л.;;452526344.0;150123487.0;063-20и;
411;246;008-5;4680008140241.0;Антисептик невымываемыйPROSEPT ULTRAконцентрат 1:10  / 5 л;1729.0;4121.0;20.0;Антисептик невымываемый для ответственных конструкций PROSEPT ULTRA, концентрат, 5 л.;Антисептик невымываемый для ответственных конструкций PROSEPT ULTRA, концентрат, 5 л.;Антисептик невымываемый для ответственных конструкций PROSEPT ULTRA, концентрат, 5 л.;189522714.0;150033486.0;008-5;
412;287;016-10;4680008140333.0;Антисептик для бани и сауны ECO SAUNAготовый состав / 10 л;473.0;1126.0;20.0;Антисептик для бани и сауны PROSEPT ECO SAUNA, 10 л.;Антисептик для бани и сауны PROSEPT ECO SAUNA, 10 л.;Антисептик для бани и сауны PROSEPT ECO SAUNA, 10 л.;189522752.0;150033020.0;016-10;
413;247;008-20;4680008140678.0;Антисептик невымываемыйPROSEPT ULTRAконцентрат 1:10 / 20 л;5414.0;10126.0;20.0;Антисептик невымываемый для ответственных конструкций PROSEPT ULTRA, концентрат, 20 л.;Антисептик невымываемый для ответственных конструкций PROSEPT ULTRA, концентрат, 20 л.;Антисептик невымываемый для ответственных конструкций PROSEPT ULTRA, концентрат, 20 л.;189522840.0;150033489.0;008-20;
414;409;065-5;4680008149657.0;Антисептик невымываемый ХМ-11, ГОСТ / 5 л;268.0;561.0;20.0;Антисептик невымываемый PROSEPT ХМ-11 ГОСТ, 5 л.;Антисептик невымываемый PROSEPT ХМ-11 ГОСТ, 5 л.;Антисептик невымываемый PROSEPT ХМ-11 ГОСТ, 5 л.;253565299.0;150033500.0;065-5;
415;402;022-5;4680008140708.0;Удалитель цемента CEMENT CLEANER концентрат 1:2 / 5 л;1147.0;2734.0;35.0;Удалитель цемента PROSEPT CEMENT CLEANER, концентрат, 5л.;Удалитель цемента PROSEPT CEMENT CLEANER, концентрат, 5л.;Удалитель цемента PROSEPT CEMENT CLEANER, концентрат, 5л.;189522729.0;149982746.0;022-5;
416;410;065-10;4680008149831.0;Антисептик невымываемый ХМ-11, ГОСТ / 10 л;511.0;1070.0;20.0;Антисептик невымываемый PROSEPT ХМ-11 ГОСТ, 10 л.;Антисептик невымываемый PROSEPT ХМ-11 ГОСТ, 10 л.;Антисептик невымываемый PROSEPT ХМ-11 ГОСТ, 10 л.;253565300.0;150033503.0;065-10;
417;313;063-10и;4680008149510.0;ОГНЕБИОЗАЩИТА I группа, красный  готовый состав / 10 кг;791.0;1609.0;38.0;PROSEPT огнебиозащита для древесины с цветовой индикацией. Высшая (1-ая) группа, 10л.;PROSEPT огнебиозащита для древесины с цветовой индикацией. Высшая (1-ая) группа, 10л.;PROSEPT огнебиозащита для древесины с цветовой индикацией. Высшая (1-ая) группа, 10л.;452523173.0;150123486.0;063-10и;
418;476;064-10;4680008149534.0;ОГНЕБИОЗАЩИТА для древесины 2 группа, бесцветный  готовый состав / 10 кг;409.0;888.0;38.0;;ОГНЕБИОЗАЩИТА 2 группа, бесцветный  готовый состав / 10 кг;;452532931.0;150123393.0;064-10;
419;26;230-1;4680008144522.0;Универсальный концентрат для мытья половMultipower FLOOR концентрат 1:10-1:200 / 1 л;101.0;236.0;50.0;Средство для мытья полов PROSEPT Multipower FLOOR, 1л.;Средство для мытья полов PROSEPT Multipower FLOOR, 1л.;Средство для мытья полов PROSEPT Multipower FLOOR, 1л.;417953523.0;151231988.0;230-1;230-10
