222;467;М015-12;4610093421123.0;Герметик акриловый цвет орех, ф/п 600мл (12 штук );3686.4;7716.96;25.0;Герметик акриловый для швов для деревянных домов, конструкций, изделий PROSEPT цвет орех, ф/п 600мл (12 штук );Герметик акриловый для швов для деревянных домов, конструкций, изделий PROSEPT цвет орех, ф/п 600мл (12 штук );Герметик акриловый для швов для деревянных домов, конструкций, изделий PROSEPT цвет орех, ф/п 600мл (12 штук );189522825.0;161240419.0;M015-12;
223;459;0024-15 м;4680008145246.0;Герметик акриловый цвет медовый, 15 кг.;4561.2;9466.8;25.0;Герметик акриловый для швов для деревянных домов, конструкций, изделий PROSEPT цвет медовый, 15 кг.;Герметик акриловый цвет медовый, 15 кг.;Герметик акриловый для швов для деревянных домов, конструкций, изделий PROSEPT цвет медовый, 15 кг.;189522837.0;150126223.0;0024-15-м;
224;224;0024-3 о;4610093420492.0;Герметик акриловый цвет Орех, 3 кг;1251.0;2145.0;25.0;Герметик акриловый для швов для деревянных домов, конструкций, изделий PROSEPT цвет орех, 3 кг.;Герметик акриловый цвет Орех, 3 кг;Герметик акриловый для швов для деревянных домов, конструкций, изделий PROSEPT цвет орех, 3 кг.;453205718.0;150126215.0;0024-3-о;
225;226;0024-3 с;4610093420515.0;Герметик акриловый цвет Сосна, 3 кг;1251.0;2145.0;25.0;Герметик акриловый для швов для деревянных домов, конструкций, изделий PROSEPT цвет сосна, 3 кг.;Герметик акриловый цвет Сосна, 3 кг;Герметик акриловый для швов для деревянных домов, конструкций, изделий PROSEPT цвет сосна, 3 кг.;453215204.0;150126208.0;0024-3-с;
226;442;0024-06 о;4680008147851.0;Герметик акриловый цвет орех, ф/п 600мл;307.0;643.0;25.0;Герметик акриловый для швов для деревянных домов, конструкций, изделий PROSEPT цвет орех, ф/п 600мл;Герметик акриловый цвет орех, ф/п 600мл;Герметик акриловый для швов для деревянных домов, конструкций, изделий PROSEPT цвет орех, ф/п 600мл;503250366.0;150126207.0;0024-06-о;
227;461;0024-15 с;4680008145239.0;Герметик акриловый цвет сосна, 15 кг.;4561.2;9466.8;25.0;Герметик акриловый для швов для деревянных домов, конструкций, изделий PROSEPT цвет сосна, 15 кг.;Герметик акриловый цвет сосна, 15 кг.;Герметик акриловый для швов для деревянных домов, конструкций, изделий PROSEPT цвет сосна, 15 кг.;189522830.0;150126222.0;0024-15-с;
228;462;0024-15 о;4680008147868.0;Герметик акриловый цвет орех, 15 кг.;4561.2;9466.8;25.0;Герметик акриловый для швов для деревянных домов, конструкций, изделий PROSEPT цвет орех, 15 кг.;Герметик акриловый цвет орех, 15 кг.;Герметик акриловый для швов для деревянных домов, конструкций, изделий PROSEPT цвет орех, 15 кг.;189522831.0;150126212.0;0024-15-о;
229;465;М016-12;4610093421130.0;Герметик акриловый  цвет сосна, ф/п 600мл (12 штук );3686.4;7716.96;25.0;Герметик акриловый для швов для деревянных домов, конструкций, изделий PROSEPT цвет сосна, ф/п 600мл (12 штук );Герметик акриловый для швов для деревянных домов, конструкций, изделий PROSEPT цвет сосна, ф/п 600мл (12 штук );Герметик акриловый для швов для деревянных домов, конструкций, изделий PROSEPT цвет сосна, ф/п 600мл (12 штук );189522824.0;161240421.0;M016-12;
230;225;0024-3 м;4610093420508.0;Герметик акриловый цвет Медовый, 3 кг;1251.0;2145.0;25.0;Герметик акриловый для швов для деревянных домов, конструкций, изделий PROSEPT цвет медовый, 3 кг.;Герметик акриловый цвет Медовый, 3 кг;Герметик акриловый для швов для деревянных домов, конструкций, изделий PROSEPT цвет медовый, 3 кг.;453214675.0;150126205.0;0024-3-м;
231;140;254-5;4680008145499.0;Кондиционер для белья с ароматом Японского чаяCrystal Rinserконцентрат / 5 л ;325.6;706.0;29.0;"Кондиционер для белья ""Японский чай"" Prosept Crystal Rinser, 5 л.";"Кондиционер для белья ""Японский чай"" Prosept Crystal Rinser, 5 л.";"Кондиционер для белья ""Японский чай"" Prosept Crystal Rinser, 5 л.";247798830.0;150032958.0;254-5;254-50
232;148;305-5;4680008148674.0;Кондиционер для белья с ароматом  королевского ИрисаCrystal Rinserконцентрат / 5 л ;325.6;706.0;29.0;"Кондиционер для белья ""Королевский ирис"" PROSEPT Crystal Rinser, 5 л.";"Кондиционер для белья ""Королевский ирис"" PROSEPT Crystal Rinser, 5 л.";"Кондиционер для белья ""Королевский ирис"" PROSEPT Crystal Rinser, 5 л.";189522730.0;150032955.0;305-5;
233;144;253-5;4680008145543.0;"Кондиционер для белья с ароматом ""Альпийская свежесть""Crystal Rinserконцентрат / 5 л ";325.6;706.0;29.0;"Кондиционер для белья ""Альпийская свежесть"" PROSEPT Crystal Rinser, 5 л.";"Кондиционер для белья ""Альпийская свежесть"" PROSEPT Crystal Rinser, 5 л.";"Кондиционер для белья ""Альпийская свежесть"" PROSEPT Crystal Rinser, 5 л.";247798827.0;150032956.0;253-5;253-50
234;223;0024-3 б;4610093420485.0;Герметик акриловый цвет Белый, 3 кг;1251.0;2145.0;25.0;Герметик акриловый для швов для деревянных домов, конструкций, изделий PROSEPT цвет белый, 3 кг.;Герметик акриловый цвет Белый, 3 кг;Герметик акриловый для швов для деревянных домов, конструкций, изделий PROSEPT цвет белый, 3 кг.;453200111.0;150126218.0;0024-3-б;
235;457;0024-06 м;4680008145215.0;Герметик акриловый цвет медовый, ф/п 600мл;307.0;643.0;25.0;Герметик акриловый для швов для деревянных домов, конструкций, изделий PROSEPT цвет медовый, ф/п 600мл;Герметик акриловый цвет медовый, ф/п 600мл;Герметик акриловый для швов для деревянных домов, конструкций, изделий PROSEPT цвет медовый, ф/п 600мл;189522733.0;150126220.0;0024-06-м;
236;464;М013-12;4610093421147.0;Герметик акриловый  цвет белый , ф/п 600 мл. (12 штук );3686.4;7716.96;25.0;Герметик акриловый белый для швов для деревянных домов, конструкций, изделий PROSEPT, ф/п 600 мл. (12 штук );Герметик акриловый белый для швов для деревянных домов, конструкций, изделий PROSEPT, ф/п 600 мл. (12 штук );Герметик акриловый белый для швов для деревянных домов, конструкций, изделий PROSEPT, ф/п 600 мл. (12 штук );189522821.0;161240420.0;M013-12;
237;448;0024-15 б;4680008145222.0;Герметик акриловый цвет белый, 15 кг.;4561.2;9466.8;25.0;Герметик акриловый для швов для деревянных домов, конструкций, изделий PROSEPT цвет белый, 15 кг.;Герметик акриловый цвет белый, 15 кг.;Герметик акриловый для швов для деревянных домов, конструкций, изделий PROSEPT цвет белый, 15 кг.;189522833.0;150126214.0;0024-15-б;
238;146;296-5;4680008147592.0;Кондиционер для белья с ароматом лепестков СакурыCrystal Rinserконцентрат / 5 л ;325.6;706.0;29.0;"Кондиционер для белья ""Лепестки Сакуры"" PROSEPT Crystal Rinser, 5 л.";"Кондиционер для белья ""Лепестки Сакуры"" PROSEPT Crystal Rinser, 5 л.";"Кондиционер для белья ""Лепестки Сакуры"" PROSEPT Crystal Rinser, 5 л.";247798828.0;150032957.0;296-5;111-70
239;138;216-5;4680008142450.0;Кондиционер для белья без красителей и ароматизаторов Crystal Rinserконцентрат / 5 л ;325.6;706.0;29.0;"Кондиционер для белья ""Sensitive"" PROSEPT Crystal Rinser, 5 л.";"Кондиционер для белья ""Sensitive"" PROSEPT Crystal Rinser, 5 л.";"Кондиционер для белья ""Sensitive"" PROSEPT Crystal Rinser, 5 л.";452245667.0;150032952.0;216-5;
240;142;252-5;4680008145529.0;Кондиционер для белья с ароматом экзотических цветовCrystal Rinserконцентрат / 5 л ;325.6;706.0;29.0;"Кондиционер для белья ""Экзотические цветы"" PROSEPT Crystal Rinser, 5 л.";"Кондиционер для белья ""Экзотические цветы"" PROSEPT Crystal Rinser, 5 л.";"Кондиционер для белья ""Экзотические цветы"" PROSEPT Crystal Rinser, 5 л.";452255455.0;150032954.0;252-5;
241;141;252-2;4680008147370.0;Кондиционер для белья с ароматом экзотических цветовCrystal Rinserконцентрат / 2 л ;147.0;319.0;29.0;"Кондиционер для белья ""Экзотические цветы"" PROSEPT Crystal Rinser, 2 л.";"Кондиционер для белья ""Экзотические цветы"" PROSEPT Crystal Rinser, 2 л.";"Кондиционер для белья ""Экзотические цветы"" PROSEPT Crystal Rinser, 2 л.";449677804.0;150032951.0;252-2;
242;486;М022-2;4610093421369.0;Набор Антисептик-грунт ОSB BASE, 1 л, 2 шт;224.0;510.0;;Набор Антисептик-грунт ОSB BASE, 1 л, 2 шт;Набор Антисептик-грунт ОSB BASE, 1 л, 2 шт;Набор Антисептик-грунт ОSB BASE, 1 л, 2 шт;;164432775.0;;
243;292;044-01;4680008146847.0;Антисептик-грунт OSB BASE готовый состав / 1 л;112.0;266.0;20.0;Антисептик-грунт для плит OSB PROSEPT ОSB BASE, готовый состав, 1 л.;Антисептик-грунт для плит OSB PROSEPT ОSB BASE, готовый состав, 1 л.;Антисептик-грунт для плит OSB PROSEPT ОSB BASE, готовый состав, 1 л.;189522782.0;150033480.0;044-01;
244;139;254-2;4680008147363.0;Кондиционер для белья с ароматом Японского чаяCrystal Rinserконцентрат / 2 л ;147.0;319.0;29.0;"Кондиционер для белья ""Японский чай"" Prosept Crystal Rinser, 2 л.";"Кондиционер для белья ""Японский чай"" Prosept Crystal Rinser, 2 л.";"Кондиционер для белья ""Японский чай"" Prosept Crystal Rinser, 2 л.";247798829.0;150032959.0;254-2;
245;480;М020-2;4610093421246.0;Набор Multipower Wood, 1 л, 2шт;251.32;564.0;;Набор Multipower Wood, 1 л, 2шт;Набор Multipower Wood, 1 л, 2шт;Набор Multipower Wood, 1 л, 2шт;;164358459.0;;
246;294;044-10;4680008146861.0;Антисептик-грунт OSB BASE готовый состав / 10 л;711.0;1694.0;20.0;Антисептик-грунт для плит OSB PROSEPT ОSB BASE, готовый состав, 10 л.;Антисептик-грунт для плит OSB PROSEPT ОSB BASE, готовый состав, 10 л.;Антисептик-грунт для плит OSB PROSEPT ОSB BASE, готовый состав, 10 л.;189522842.0;150033475.0;044-10;
247;481;М021-2;4610093421260.0;Набор Universal Wood спрей, 0.5 л, 2шт;186.0;418.0;;Набор Universal Wood спрей, 0.5 л, 2шт;Набор Universal Wood спрей, 0.5 л, 2шт;Набор Universal Wood спрей, 0.5 л, 2шт;;164358830.0;;
248;41;271-5;4680008147547.0;Средство для мытья плитки и керамогранитаMultipower Keramaконцентрат  / 5 л;370.86;866.0;40.0;Средство для мытья плитки и керамогранита PROSEPT Multipower Kerama, 5 л.;Средство для мытья плитки и керамогранита PROSEPT Multipower Kerama, 5 л.;Средство для мытья плитки и керамогранита PROSEPT Multipower Kerama, 5 л.;451160686.0;149705830.0;271-5;
249;40;271-1;4680008146724.0;Средство для мытья плитки и керамогранитаMultipower Keramaконцентрат  / 1 л;133.0;312.0;40.0;Средство для мытья плитки и керамогранита PROSEPT Multipower Kerama, 1 л.;Средство для мытья плитки и керамогранита PROSEPT Multipower Kerama, 1 л.;Средство для мытья плитки и керамогранита PROSEPT Multipower Kerama, 1 л.;448645879.0;149705829.0;271-1;
250;39;267-1;4680008146380.0;Моющее средство для бани и сауныMultipower Wood концентрат / 1 л;125.66;294.0;40.0;Моющее средство для бани и сауны PROSEPT Multipower Wood, 1 л.;Моющее средство для бани и сауны PROSEPT Multipower Wood, 1 л.;Моющее средство для бани и сауны PROSEPT Multipower Wood, 1 л.;448674421.0;150029137.0;267-1;
251;20;264-05;4680008146397.0;Спрей для очистки полков в банях и саунах Universal Woodготовый состав / 0,5л;93.0;218.0;40.0;Спрей для очистки полков в банях и саунах PROSEPT Universal Wood, 0.5 л.;Спрей для очистки полков в банях и саунах PROSEPT Universal Wood, 0.5 л.;Спрей для очистки полков в банях и саунах PROSEPT Universal Wood, 0.5 л.;448714470.0;150029138.0;264-05;264-150
252;137;216-2;4680008147394.0;Кондиционер для белья без красителей и ароматизаторов Crystal Rinserконцентрат / 2 л ;147.0;319.0;29.0;"Кондиционер для белья ""Sensitive"" PROSEPT Crystal Rinser, 2 л.";"Кондиционер для белья ""Sensitive"" PROSEPT Crystal Rinser, 2 л.";"Кондиционер для белья ""Sensitive"" PROSEPT Crystal Rinser, 2 л.";449766789.0;150032953.0;216-2;
253;405;023-5;4680008140715.0;Удалитель ржавчины RUST REMOVER концентрат  1:2 / 5 л;1487.0;3541.0;35.0;Удалитель ржавчины PROSEPT RUST REMOVER, концентрат, 5 л.;Удалитель ржавчины PROSEPT RUST REMOVER, концентрат, 5 л.;Удалитель ржавчины PROSEPT RUST REMOVER, концентрат, 5 л.;453042106.0;149988966.0;023-5;
254;215;077-5;4610093420621.0;Антисептик усиленный невымываемыйPROSEPT ULTRA MAXконцентрат 1:10 / 5 кг;1989.0;4738.0;20.0;Антисептик усиленный невымываемый PROSEPT ULTRA MAX, концентрат, 5 л.;Антисептик усиленный невымываемый PROSEPT ULTRA MAX, концентрат, 5 л.;Антисептик усиленный невымываемый PROSEPT ULTRA MAX, концентрат, 5 л.;453229851.0;150030037.0;077-5;
255;240;001-1;4680008140012.0;Отбеливатель для древесиныPROSEPT 50концентрат 1:1 / 1 л;220.0;523.0;35.0;Отбеливатель для древесины PROSEPT 50, концентрат, 1 л.;Отбеливатель для древесины PROSEPT 50, концентрат, 1 л.;Отбеливатель для древесины PROSEPT 50, концентрат, 1 л.;452569032.0;149966035.0;001-1;
256;214;077-1;4610093420645.0;Антисептик усиленный невымываемыйPROSEPT ULTRA MAXконцентрат 1:10 / 1 кг;414.0;986.0;20.0;Антисептик усиленный невымываемый PROSEPT ULTRA MAX, концентрат, 1 л.;Антисептик усиленный невымываемый PROSEPT ULTRA MAX, концентрат, 1 л.;Антисептик усиленный невымываемый PROSEPT ULTRA MAX, концентрат, 1 л.;453228072.0;150030036.0;077-1;
257;259;005-1;4680008140142.0;Антисептик универсальный для наружных и внутренних работPROSEPT UNIVERSALконцентрат 1:10 / 1 л;314.0;748.0;20.0;Антисептик универсальный для наружных и внутренних работ PROSEPT UNIVERSAL, концентрат, 1 л.;Антисептик универсальный для наружных и внутренних работ PROSEPT UNIVERSAL, концентрат, 1 л.;Антисептик универсальный для наружных и внутренних работ PROSEPT UNIVERSAL, концентрат, 1 л.;189522711.0;150033510.0;005-1;
258;291;025-10;4680008144256.0;Антисептик против грибка и плесени АНТИПЛЕСЕНЬ готовый состав / 10 л;465.0;1107.0;20.0;Антисептик против плесени и грибка PROSEPT АНТИПЛЕСЕНЬ, 10 л.;Антисептик против плесени и грибка PROSEPT АНТИПЛЕСЕНЬ, 10 л.;Антисептик против плесени и грибка PROSEPT АНТИПЛЕСЕНЬ, 10 л.;189522779.0;150033473.0;025-10;
259;290;025-5;4680008144263.0;Антисептик против грибка и плесени АНТИПЛЕСЕНЬ готовый состав / 5 л;251.0;598.0;20.0;Антисептик универсальный против грибка и плесени PROSEPT АНТИПЛЕСЕНЬ, 5 л.;Антисептик универсальный против грибка и плесени PROSEPT АНТИПЛЕСЕНЬ, 5 л.;Антисептик универсальный против грибка и плесени PROSEPT АНТИПЛЕСЕНЬ, 5 л.;189522744.0;150033472.0;025-5;
260;242;001-10;4680008140036.0;Отбеливатель для древесиныPROSEPT 50концентрат 1:1 / 10 л;1303.0;3105.0;35.0;Отбеливатель для древесины PROSEPT 50, концентрат, 10 л.;Отбеливатель для древесины PROSEPT 50, концентрат, 10 л.;Отбеливатель для древесины PROSEPT 50, концентрат, 10 л.;189522836.0;149966032.0;001-10;
261;243;001-20;4680008140043.0;Отбеливатель для древесиныPROSEPT 50концентрат 1:1 / 20 л;2597.0;5127.0;35.0;Отбеливатель для древесины PROSEPT 50, концентрат, 20 л.;Отбеливатель для древесины PROSEPT 50, концентрат, 20 л.;Отбеливатель для древесины PROSEPT 50, концентрат, 20 л.;189522832.0;149966031.0;001-20;
262;261;005-20;4680008140647.0;Антисептик универсальный для наружных и внутренних работPROSEPT UNIVERSALконцентрат 1:10 / 20 л;4457.0;8804.0;20.0;Антисептик универсальный для наружных и внутренних работ PROSEPT UNIVERSAL, концентрат, 20 л.;Антисептик универсальный для наружных и внутренних работ PROSEPT UNIVERSAL, концентрат, 20 л.;Антисептик универсальный для наружных и внутренних работ PROSEPT UNIVERSAL, концентрат, 20 л.;189522834.0;150033512.0;005-20;
263;260;005-5;4680008140159.0;Антисептик универсальный для наружных и внутренних работPROSEPT UNIVERSALконцентрат 1:10 / 5 л;1175.0;2799.0;20.0;Антисептик универсальный для наружных и внутренних работ PROSEPT UNIVERSAL, концентрат, 5 л.;Антисептик универсальный для наружных и внутренних работ PROSEPT UNIVERSAL, концентрат, 5 л.;Антисептик универсальный для наружных и внутренних работ PROSEPT UNIVERSAL, концентрат, 5 л.;232685985.0;150033513.0;005-5;
264;16;304-05;4680008148612.0;Средство для ухода за мебелью (полироль)Universal Polish  готовый состав / 0,5 л ;109.93;257.0;36.0;Полироль для мебели Prosept Polish, 0.5 л.;Полироль для мебели Prosept Polish, 0.5 л.;Полироль для мебели Prosept Polish, 0.5 л.;189522827.0;149419143.0;304-05;304-150
265;81;262-05;4680008146304.0;Спрей для столешниц и раковин из искусственного камня и гранитаCooky Spray  готовый состав / 0,5 л;84.9;199.0;48.0;Спрей для столешниц и раковин из искусственного камня и гранита PROSEPT Cooky Spray, 0.5 л.;Спрей для столешниц и раковин из искусственного камня и гранита PROSEPT Cooky Spray, 0.5 л.;Спрей для столешниц и раковин из искусственного камня и гранита PROSEPT Cooky Spray, 0.5 л.;411892358.0;150087033.0;262-05;262-050
266;115;233-5;4680008144591.0;Моющий концентрат для удаления индустриальных загрязненийDuty General концентрат 1:10-1:80 / 5 л;499.99;1168.0;35.0;Моющий концентрат для удаления индустриальных загрязнений PROSEPT Duty General, 5 л.;Моющий концентрат для удаления индустриальных загрязнений PROSEPT Duty General, 5 л.;Моющий концентрат для удаления индустриальных загрязнений PROSEPT Duty General, 5 л.;451947750.0;149992149.0;233-5;
267;193;O1 01500;4680008147554.0;Нейтрализатор неприятных запаховFLOX PROFготовый состав / 0,5 л ;126.67;295.0;34.0;Профессиональный нейтрализатор неприятных запахов PROSEPT Flox Prof;Профессиональный нейтрализатор неприятных запахов PROSEPT Flox Prof;Профессиональный нейтрализатор неприятных запахов PROSEPT Flox Prof;452376063.0;149595528.0;O1-01500;
268;440;0024-06 т;4610093420539.0;Герметик акриловый цвет тик, ф/п 600мл;307.0;644.0;25.0;Герметик акриловый для швов для деревянных домов, конструкций, изделий PROSEPT цвет тик, ф/п 600мл;Герметик акриловый цвет тик, ф/п 600мл;Герметик акриловый для швов для деревянных домов, конструкций, изделий PROSEPT цвет тик, ф/п 600мл;453196408.0;150126203.0;0024-06-т;
269;29;231-5;4680008144676.0;Концентрат эконом-класса для мытья половMultipower E (цитрус)  концентрат 1:5-1:150 / 5 л;322.0;752.0;50.0;Средство для мытья полов всех типов PROSEPT Multipower E Citrus, 5 л.;Средство для мытья полов всех типов PROSEPT Multipower E Citrus, 5 л.;Средство для мытья полов всех типов PROSEPT Multipower E Citrus, 5 л.;417953524.0;151231989.0;231-5;
