;id;article;ean_13;name;cost;recommended_price;category_id;ozon_name;name_1c;wb_name;ozon_article;wb_article;ym_article;wb_article_td
0;245;008-1;4680008140234.0;Антисептик невымываемыйPROSEPT ULTRAконцентрат 1:10  / 1 л;360.0;858.0;20.0;Антисептик невымываемый для ответственных конструкций PROSEPT ULTRA, концентрат, 1 л.;Антисептик невымываемый для ответственных конструкций PROSEPT ULTRA, концентрат, 1 л.;Антисептик невымываемый для ответственных конструкций PROSEPT ULTRA, концентрат, 1 л.;189522705.0;150033482.0;008-1;
1;3;242-12;;Антигололед - 32 PROSEPTготовый состав / 12 кг;460.16;1075.0;;;Антигололед - 32 PROSEPTготовый состав / 12 кг;;;;;
2;443;0024-06 с;4680008145208.0;Герметик акриловый цвет сосна, ф/п 600мл;307.0;644.0;25.0;Герметик акриловый для швов для деревянных домов, конструкций, изделий PROSEPT цвет сосна, ф/п 600мл;Герметик акриловый цвет сосна, ф/п 600мл;Герметик акриловый для швов для деревянных домов, конструкций, изделий PROSEPT цвет сосна, ф/п 600мл;189522735.0;150126217.0;0024-06-с;
3;147;305-2;4610093420164.0;Кондиционер для белья с ароматом  королевского ИрисаCrystal Rinserконцентрат / 2 л ;157.73;342.0;29.0;"Кондиционер для белья ""Королевский Ирис"" Prosept Crystal Rinser, 2 л.";"Кондиционер для белья ""Королевский Ирис"" Prosept Crystal Rinser, 2 л.";"Кондиционер для белья ""Королевский Ирис"" Prosept Crystal Rinser, 2 л.";339377922.0;150032962.0;305-2;
4;502;0024-7 б;;Герметик акриловой  цвет Белый, 7 кг;;;;;;;189522867.0;150126216.0;0024-7-б;
5;220;051-6;4610093420607.0;Грунт БЕТОНКОНТАКТготовый состав / 6 кг;703.0;1339.0;26.0;Грунт бетоноконтакт, для гладких поверхностей перед нанесением штукатурок, шпатлевок и плиточного клея, готовый состав, 6 кг;Грунт бетоноконтакт, для гладких поверхностей перед нанесением штукатурок, шпатлевок и плиточного клея, готовый состав, 6 кг;Грунт бетоноконтакт, для гладких поверхностей перед нанесением штукатурок, шпатлевок и плиточного клея, готовый состав, 6 кг;453193200.0;149699633.0;051-6;
6;385;051-10;4680008147998.0;Грунт БЕТОНКОНТАКТготовый состав / 12 кг;1111.0;2505.0;26.0;Грунт бетоноконтакт, для гладких поверхностей перед нанесением штукатурок, шпатлевок и плиточного клея, готовый состав, 12 кг;Грунт бетоноконтакт, для гладких поверхностей перед нанесением штукатурок, шпатлевок и плиточного клея, готовый состав, 12 кг;Грунт бетоноконтакт, для гладких поверхностей перед нанесением штукатурок, шпатлевок и плиточного клея, готовый состав, 12 кг;189522783.0;149699627.0;051-10;
7;114;125-5;4680008141842.0;Средство для удаления технических масел, смазочных материалов и нефтепродуктовDuty Oil концентрат 1:20-1:150 /  5 л;711.82;1663.0;35.0;Средство для удаления технических масел, смазочных материалов и нефтепродуктов PROSEPT Duty Oil, 5 л.;Средство для удаления технических масел, смазочных материалов и нефтепродуктов PROSEPT Duty Oil, 5 л.;Средство для удаления технических масел, смазочных материалов и нефтепродуктов PROSEPT Duty Oil, 5 л.;189522869.0;149992148.0;125-5;
8;505;СФ001-5;4610093421024.0;Антисептик универсальный суперсильный;200.0;510.0;20.0;Антисептик универсальный суперсильный;Антисептик универсальный суперсильный;Антисептик универсальный суперсильный;;;;
9;32;100-1;4680008141705.0;Средство для мытья светлых полов с отбеливающим эффектомMultipower Whiteконцентрат 1:20-1:200 / 1 л;132.72;311.0;40.0;Профессиональное средство для мытья светлых полов с отбеливающим эффектом PROSEPT Multipower White, 1 л.;Профессиональное средство для мытья светлых полов с отбеливающим эффектом PROSEPT Multipower White, 1 л.;Профессиональное средство для мытья светлых полов с отбеливающим эффектом PROSEPT Multipower White, 1 л.;451088021.0;149705841.0;100-1;
10;241;001-5;4680008140029.0;Отбеливатель для древесины PROSEPT 50концентрат 1:1 / 5 л;682.0;1626.0;35.0;Отбеливатель для древесины PROSEPT 50, концентрат, 5 л.;Отбеливатель для древесины PROSEPT 50, концентрат, 5 л.;Отбеливатель для древесины PROSEPT 50, концентрат, 5 л.;189522702.0;149966030.0;001-5;
11;339;040-9;4680008145987.0;Антисептик лессирующий BiO LASUR / тик / 9 л;2159.0;5145.0;31.0;Антисептик лессирующийзащитно-декоративныйPROSEPT BiO LASUR / тик / 9 л;Антисептик лессирующийзащитно-декоративныйPROSEPT BiO LASUR / тик / 9 л;Антисептик лессирующийзащитно-декоративныйPROSEPT BiO LASUR / тик / 9 л;577626084.0;;;
12;346;038-09;4680008146144.0;Антисептик лессирующий BiO LASUR / махагон / 0,9 л;255.0;607.0;31.0;Антисептик лессирующийзащитно-декоративныйPROSEPT BiO LASUR / махагон / 0,9 л;Антисептик лессирующийзащитно-декоративныйPROSEPT BiO LASUR / махагон / 0,9 л;Антисептик лессирующийзащитно-декоративныйPROSEPT BiO LASUR / махагон / 0,9 л;577610937.0;;;
13;343;034-09;4680008145994.0;Антисептик лессирующий BiO LASUR / лиственница / 0,9 л;255.0;607.0;31.0;Антисептик лессирующийзащитно-декоративныйPROSEPT BiO LASUR / лиственница / 0,9 л;Антисептик лессирующийзащитно-декоративныйPROSEPT BiO LASUR / лиственница / 0,9 л;Антисептик лессирующийзащитно-декоративныйPROSEPT BiO LASUR / лиственница / 0,9 л;577614089.0;;;
14;337;040-09;4680008145963.0;Антисептик лессирующий BiO LASUR / тик / 0,9 л;255.0;607.0;31.0;Антисептик лессирующийзащитно-декоративныйPROSEPT BiO LASUR / тик / 0,9 л;Антисептик лессирующийзащитно-декоративныйPROSEPT BiO LASUR / тик / 0,9 л;Антисептик лессирующийзащитно-декоративныйPROSEPT BiO LASUR / тик / 0,9 л;577621671.0;;;
15;43;284-08;4680008147196.0;"Средство для мытья полов и стенMultipower ""Полевые цветы""концентрат  1:10 – 1:120 / 0,8 л";77.94;182.0;;;"Средство для мытья полов и стенMultipower ""Полевые цветы""концентрат  1:10 – 1:120 / 0,8 л";;;;;
16;338;040-2;4680008145970.0;Антисептик лессирующий BiO LASUR / тик / 2,7 л;721.0;1717.0;31.0;Антисептик лессирующийзащитно-декоративныйPROSEPT BiO LASUR / тик / 2,7 л;Антисептик лессирующийзащитно-декоративныйPROSEPT BiO LASUR / тик / 2,7 л;Антисептик лессирующийзащитно-декоративныйPROSEPT BiO LASUR / тик / 2,7 л;577624042.0;;;
17;348;038-9;4680008146168.0;Антисептик лессирующий BiO LASUR / махагон / 9 л;2159.0;5145.0;31.0;Антисептик лессирующийзащитно-декоративныйPROSEPT BiO LASUR / махагон / 9 л;Антисептик лессирующийзащитно-декоративныйPROSEPT BiO LASUR / махагон / 9 л;Антисептик лессирующийзащитно-декоративныйPROSEPT BiO LASUR / махагон / 9 л;577613095.0;;;
18;341;036-2;4680008146120.0;Антисептик лессирующий BiO LASUR / дуб / 2,7 л;721.0;1717.0;31.0;Антисептик лессирующийзащитно-декоративныйPROSEPT BiO LASUR / дуб / 2,7 л;Антисептик лессирующийзащитно-декоративныйPROSEPT BiO LASUR / дуб / 2,7 л;Антисептик лессирующийзащитно-декоративныйPROSEPT BiO LASUR / дуб / 2,7 л;577620203.0;;;
19;352;039-09;4680008146052.0;Антисептик лессирующий BiO LASUR / палисандр / 0,9 л;255.0;607.0;31.0;Антисептик лессирующийзащитно-декоративныйPROSEPT BiO LASUR / палисандр / 0,9 л;Антисептик лессирующийзащитно-декоративныйPROSEPT BiO LASUR / палисандр / 0,9 л;Антисептик лессирующийзащитно-декоративныйPROSEPT BiO LASUR / палисандр / 0,9 л;577514976.0;;;
20;353;039-2;4680008146069.0;Антисептик лессирующий BiO LASUR / палисандр / 2,7 л;721.0;1717.0;31.0;Антисептик лессирующийзащитно-декоративныйPROSEPT BiO LASUR / палисандр / 2,7 л;Антисептик лессирующийзащитно-декоративныйPROSEPT BiO LASUR / палисандр / 2,7 л;Антисептик лессирующийзащитно-декоративныйPROSEPT BiO LASUR / палисандр / 2,7 л;577515287.0;;;
21;354;039-9;4680008146076.0;Антисептик лессирующий BiO LASUR / палисандр / 9 л;2159.0;5145.0;31.0;Антисептик лессирующийзащитно-декоративныйPROSEPT BiO LASUR / палисандр / 9 л;Антисептик лессирующийзащитно-декоративныйPROSEPT BiO LASUR / палисандр / 9 л;Антисептик лессирующийзащитно-декоративныйPROSEPT BiO LASUR / палисандр / 9 л;577516280.0;;;
22;351;037-9;4680008146045.0;Антисептик лессирующий BiO LASUR / орех / 9 л;2159.0;5145.0;31.0;Антисептик лессирующийзащитно-декоративныйPROSEPT BiO LASUR / орех / 9 л;Антисептик лессирующийзащитно-декоративныйPROSEPT BiO LASUR / орех / 9 л;Антисептик лессирующийзащитно-декоративныйPROSEPT BiO LASUR / орех / 9 л;577518230.0;;;
23;503;0024-7 о;;;;;;;;;;150126213.0;;
24;44;283-08;4680008147172.0;"Средство для мытья полов и стен Multipower ""После дождя""концентрат 1:10 – 1:120 / 0,8 л";77.94;182.0;;;"Средство для мытья полов и стен Multipower ""После дождя""концентрат 1:10 – 1:120 / 0,8 л";;;;;
25;84;132-05;4680008145437.0;Гель для мытья  посуды вручную. Без запахаCookyконцентрированное средство / 0,5 л ;80.0;174.0;41.0;Гель для мытья  посуды вручную. Без запахаCookyконцентрированное средство / 0,5 л ;Гель для мытья  посуды вручную. Без запахаCookyконцентрированное средство / 0,5 л ;Гель для мытья  посуды вручную. Без запахаCookyконцентрированное средство / 0,5 л ;;;;
26;55;294-075;4680008147479.0;Средство усиленного действия для удаления ржавчины и минеральных отложенийBath Acid +  с ароматом цитрусаконцентрат 1:200-1:500 / 0,75 л;75.0;176.0;52.0;Средство PROSEPT усиленного действия для удаления ржавчины и минеральных отложений Bath Acid +  с аромат цитруса. Концентрат. 0,75л;Средство PROSEPT усиленного действия для удаления ржавчины и минеральных отложений Bath Acid +  с аромат цитруса. Концентрат. 0,75л;Средство PROSEPT усиленного действия для удаления ржавчины и минеральных отложений Bath Acid +  с аромат цитруса. Концентрат. 0,75л;413264552.0;149811030.0;294-075;294-0750
27;466;М014-12;4610093421062.0;Герметик акриловый  цвет медовый ф/п 600 мл. (12 штук );3686.4;7716.96;25.0;Герметик акриловый белый для швов для деревянных домов, конструкций, изделий PROSEPT цвет медовый ф/п 600 мл. (12 штук );Герметик акриловый белый для швов для деревянных домов, конструкций, изделий PROSEPT цвет медовый ф/п 600 мл. (12 штук );Герметик акриловый белый для швов для деревянных домов, конструкций, изделий PROSEPT цвет медовый ф/п 600 мл. (12 штук );189522826.0;161240422.0;M014-12;
28;78;143-20;4680008143457.0;Cредство для чистки коптильных камерCooky Smokeконцентрат 1:10-1:100 / 20 л;2781.0;6496.0;49.0;Cредство для чистки коптильных камерCooky Smokeконцентрат 1:10-1:100 / 20 л;Cредство для чистки коптильных камерCooky Smokeконцентрат 1:10-1:100 / 20 л;Cредство для чистки коптильных камерCooky Smokeконцентрат 1:10-1:100 / 20 л;;;;
29;95;300-5;4680008148179.0;Гель эконом-класса для мытья посуды вручную. С ароматом лимонаCooky Gel Lemon концентрированное средство / 5 л ;421.0;914.0;41.0;Гель эконом-класса для мытья посуды вручную. С ароматом лимонаCooky Gel Lemon концентрированное средство / 5 л ;Гель эконом-класса для мытья посуды вручную. С ароматом лимонаCooky Gel Lemon концентрированное средство / 5 л ;Гель эконом-класса для мытья посуды вручную. С ароматом лимонаCooky Gel Lemon концентрированное средство / 5 л ;;;;
30;183;251-5/5;4680008145277.0;Антибактериальное мылоDiona Antibacготовое средство / 5 л ПЭТ;418.0;907.0;33.0;Антибактериальное мылоDiona Antibacготовое средство / 5 л ПЭТ;Антибактериальное мылоDiona Antibacготовое средство / 5 л ПЭТ;Антибактериальное мылоDiona Antibacготовое средство / 5 л ПЭТ;;;;
31;118;273-20;;Средство усиленного действия для чистки коптильных камерDuty Fogконцентрат / 20 л;3730.0;8712.0;;;;;;;;
32;119;274-20;;Средство низкопенное  для  очистки  алюминия и сплавов на его основеDuty Mud  концентрат / 20 л;2818.0;6581.0;;;;;;;;
33;145;296-2;4680008149985.0;Кондиционер для белья с ароматом лепестков СакурыCrystal Rinserконцентрат / 2 л ;163.91;355.0;29.0;"Кондиционер для белья ""Лепестки Сакуры"" PROSEPT Crystal Rinser, 2 л.";"Кондиционер для белья ""Лепестки Сакуры"" PROSEPT Crystal Rinser, 2 л.";"Кондиционер для белья ""Лепестки Сакуры"" PROSEPT Crystal Rinser, 2 л.";338908451.0;150032961.0;296-2;
34;506;М001-3;4610093420973.0;Набор для посудомоечной посуды PROSEPT, 3 средства;638.0;1489.0;;Набор для посудомоечной посуды PROSEPT, 3 средства;Набор для посудомоечной машины PROSEPT, 3 средства;Набор для посудомоечной посуды Splash, 3 средства;461916238.0;150666267.0;М001-3;
35;504;w022-05;;;;;;;;;;;;
36;134;217-1;4680008143846.0;Стиральный порошок для белых тканейCrystal White / 5 кг ПЭТ;704.0;1645.0;54.0;Стиральный порошок для белых тканейCrystal White / 5 кг ПЭТ;Стиральный порошок для белых тканейCrystal White / 5 кг ПЭТ;Стиральный порошок для белых тканейCrystal White / 5 кг ПЭТ;;;;
37;507;М002-6;4610093420959.0;Набор для стирки PROSEPT, 6 средств для всех типов тканей;1109.0;2589.0;;Набор для стирки PROSEPT, 6 средств для всех типов тканей;Набор для стирки PROSEPT, 6 средств для всех типов тканей;Набор для стирки PROSEPT, 6 средств для всех типов тканей;461877062.0;150665521.0;М002-6;
38;483;М018-2;4610093421222.0;Набор Удалитель мха, концентрат 1 л, 2 шт;482.0;1102.0;;Набор Удалитель мха, концентрат 1 л, 2 шт;Набор Удалитель мха, концентрат 1 л, 2 шт;Набор Удалитель мха, концентрат 1 л, 2 шт;;;;
39;508;М003-2;4610093420980.0;Набор для посудомоечной посуды PROSEPT, 2 средства (гель и ополаскиватель);512.0;1195.0;;Набор для посудомоечной посуды PROSEPT, 2 средства (гель и ополаскиватель);Набор для посудомоечной машины PROSEPT, 2 средства;Набор для посудомоечной посуды Splash, гель и ополаскиватель;463666869.0;150666268.0;М003-2;
40;437;0024-06 б;4680008145192.0;Герметик акриловый цвет белый, ф/п 600 мл.;307.2;643.08;25.0;Герметик акриловый белый для швов для деревянных домов, конструкций, изделий PROSEPT, ф/п 600 мл.;Герметик акриловый цвет белый, ф/п 600 мл.;Герметик акриловый белый для швов для деревянных домов, конструкций, изделий PROSEPT, ф/п 600 мл.;189522732.0;150126210.0;0024-06-б;
41;295;006-10;4680008140210.0;Огнебиозащита ОГНЕБИО PROF 2 группа бесцветный готовый состав / 10 л;425.0;1012.0;38.0;Огнебиозащита для древесины PROSEPT ОГНЕБИО PROF  2-ая группа, 10л.;Огнебиозащита для древесины PROSEPT ОГНЕБИО PROF  2-ая группа, 10л.;Огнебиозащита для древесины PROSEPT ОГНЕБИО PROF  2-ая группа, 10л.;189522835.0;154127918.0;006-10;
42;509;М004-2;4610093420997.0;Набор для посудомоечной посуды PROSEPT, 2 средства (ополаскиватель и соль);322.0;752.0;;Набор для посудомоечной посуды PROSEPT, 2 средства (ополаскиватель и соль);Набор для посудомоечной машины - 1 PROSEPT, 2 средства;Набор для посудомоечной посуды Splash, ополаскиватель и соль;463671331.0;150666269.0;М004-2;
43;510;М005-2;4610093421000.0;"Набор ""Антиплесень"" PROSEPT (удалитель плесени и защита от плесени)";354.0;827.0;;"Набор ""Антиплесень"" PROSEPT (удалитель плесени и защита от плесени)";"Набор ""Антиплесень"" PROSEPT (удалитель плесени и защита от плесени)";"Набор ""Антиплесень"" :удалитель плесени и защита от плесени";463682015.0;150668683.0;М005-2;
44;177;141-5/5;4680008143921.0;жидкое гель-мыло эконом-класса. C ароматом яблокаDiona Apple Eготовое средство / 5 л ПЭТ;176.86;384.0;33.0;жидкое гель-мыло эконом-класса. C ароматом яблокаDiona Apple Eготовое средство / 5 л ПЭТ;жидкое гель-мыло эконом-класса. C ароматом яблокаDiona Apple Eготовое средство / 5 л ПЭТ;жидкое гель-мыло эконом-класса. C ароматом яблокаDiona Apple Eготовое средство / 5 л ПЭТ;;;;
45;187;D1 01050;4680008148605.0;"Кожный антисептик ПРОФ ДЗ ""PROF DZ"" готовый состав / 0,05 л";44.0;0.0;21.0;"Кожный антисептик ПРОФ ДЗ ""PROF DZ"" готовый состав / 0,05 л";"Кожный антисептик ПРОФ ДЗ ""PROF DZ"" готовый состав / 0,05 л";"Кожный антисептик ПРОФ ДЗ ""PROF DZ"" готовый состав / 0,05 л";;;;
46;182;P1 11005;;Cредство для рук гигиеническое с антибактериальным эффектом PROSEPT готовый состав / 5 л;565.0;1319.0;;;;;;;;
47;181;P1 11800;;Cредство для рук гигиеническое с антибактериальным эффектом PROSEPT готовый состав / 0,8 л;155.0;361.0;;;;;;;;
48;512;М009-2;4610093421192.0;"Средство для мытья полов PROSEPT Multipower ""Вершины Тибета"", 2 штуки*0.8 л.";156.0;364.0;;"Средство для мытья полов PROSEPT Multipower ""Вершины Тибета"", 2 штуки*0.8 л.";"Набор средств для мытья полов PROSEPT Multipower ""Вершины Тибета"", 800 мл, 2 шт.";;451196851.0;;М009-2;
49;179;222-5;4680008143815.0;Пенное мыло для дозаторов. Без красителей и ароматизаторовDiona Flowerконцентрат / 5 л ;465.74;848.0;33.0;Пенное мыло для дозаторов. Без красителей и ароматизаторовDiona Flowerконцентрат / 5 л ;Пенное мыло для дозаторов. Без красителей и ароматизаторовDiona Flowerконцентрат / 5 л ;Пенное мыло для дозаторов. Без красителей и ароматизаторовDiona Flowerконцентрат / 5 л ;;;;
50;511;М006-2;4610093421017.0;Набор для удаления загрязнений и наклеек PROSEPT, 2 средства (универсальный спрей для уборки и удалитель наклеек);284.0;664.0;;Набор для удаления загрязнений и наклеек PROSEPT, 2 средства (универсальный спрей для уборки и удалитель наклеек);Набор для удаления загрязнений и наклеек PROSEPT;Набор для удаления загрязнений и наклеек , 2 средства;464002480.0;150654375.0;М006-2;
51;484;М019-2;4610093421239.0;Набор Удалитель мха, готовый состав, 1 л, 2 шт;400.0;915.0;;Набор Удалитель мха, готовый состав, 1 л, 2 шт;Набор Удалитель мха, готовый состав, 1 л, 2 шт;Набор Удалитель мха, готовый состав, 1 л, 2 шт;;;;
